1088;ART1978;Imprimante Epson WorkForce WF-7830D;FA0017;269,90  EUR;323,88  EUR;;-1,000;;1,000;;707401;EPSON, Imprimante multifonctions, Ecran tactile, Technologie d'impression Jet d'encre couleur, Fonction impression recto-verso, Résolution jusqu'à 4 800 x 2 400 dpi, Vitesse d'impression jusqu'à 25 ppm (mono), jusqu'à 22 ppm (couleur), Type de support Enveloppes, papier uni, papier photo A4 / A5 / A3 / B5 / B4 A6, Interfaces 1 x USB 2.0 - USB 4 broches type B, 1 x LAN - RJ-45, Dimensions (LxPxH) 51.5 x 40 x 35 cm, 18,2 kg, Garantie 1 an  Information pour nous :  Matériel inclus : 1 x Cartouche (noir) _ 1 x Cartouche (cyan) _ 1 x Cartouche (magenta) _ 1 x Cartouche (jaune);3;
1089;ART2435;Imprimante HP LaserJet M209dwe;FA0017;154,90  EUR;185,88  EUR;-2,000;-2,000;;;;707401;"HP - Imprimante - Noir et blanc - Recto-verso - laser - A4/Legal - 600 x 600 ppp - jusqu'à 29 ppm - capacité : 150 feuilles - USB 2.0; LAN; Wi-Fi(n); Bluetooth LE - utilise uniquement du toner HP d'origine - Garantie 2 ans";3;
1090;ART2598;Imprimante Laser monochrome;FA0017;499,00  EUR;598,80  EUR;-4,000;-4,000;;;;707401;"""LaserJet Pro "" Imprimante laser monochrome multifonctions, A4 (fax, photocopieur, scanner), recto-verso, rés. 1200 x 1200 ppp, vitesse 47 ppm, écran tactile 2.7"", capacité std 250 feuilles, niv. sonore 52 dB, USB 2.0, LAN, Wifi, NFC, 9.4 kg - Garantie 1 an";3;
1091;ART0999;Imprimante laser monochrome HP M102;FA0017;149,00  EUR;178,80  EUR;;-1,000;;1,000;;707401;HP LaserJet - Imprimante laser monochrome A4, recto-verso, résolution 600 x 600 ppp, vitesse jusqu'à 22 ppm, capacité totale 150 feuilles, interfaces USB 2.0, dim. (LxPxH) 364.7 x 190.6 x 247.3 mm, 4,7 kg;3;
1092;ART1480;Imprimante monochrome HP  M404dn;FA0017;319,00  EUR;382,80  EUR;;-1,000;;1,000;;707401;HP LaserJet - Imprimante laser monochrome A4, Filaire,  recto-verso, résolution 4 800 x 600 dpi,  écran LCD, Type de support Enveloppes, étiquettes, papier uni, papier, papier recyclé, papier à faible grammage, papier perforé, papier préimprimé, capacité totale 350 feuilles, interfaces 1 x USB 2.0 - USB 4 broches type B 1 x LAN Gigabit - RJ-45 1 x USB host - USB de type A 4 broches, dim (LxPxH) 38,1 x 35,7 x 21,6 cm, 8,56 kg;3;
1093;ART2565;Imprimante monochrome HP  M404dw;FA0017;319,00  EUR;382,80  EUR;-1,000;-1,000;;;;707401;HP LaserJet - Imprimante laser monochrome A4, recto-verso, résolution 4 800 x 600 dpi,  écran LCD, Type de support Enveloppes, étiquettes, papier uni, papier, papier recyclé, papier à faible grammage, papier perforé, papier préimprimé, capacité totale 350 feuilles, interfaces 1 x USB 2.0 - USB 4 broches type B 1 x LAN Gigabit - RJ-45 1 x USB host - USB de type A 4 broches, dim (LxPxH) 38,1 x 35,7 x 21,6 cm, 8,56 kg;3;
1094;ART2813;Imprimante monochrome HP M140;FA0017;319,00  EUR;382,80  EUR;;;;;;707401;HP LaserJet MFP M140we - Imprimante multifonctions - Noir et blanc - laser - Letter A (216 x 279 mm)/A4 (210 x 297 mm) (original) - A4/Letter (support) - jusqu'à 20 ppm (copie) - jusqu'à 20 ppm (impression) - 150 feuilles - USB 2.0, Wi-Fi(n), Bluetooth -  Garantie 1an;3;
1095;ART1478;Imprimante monochrome HP M404dn;FA0017;209,00  EUR;250,80  EUR;-3,000;-4,000;;1,000;;707401;HP LaserJet - Imprimante laser monochrome A4, Filaire,  recto-verso, résolution 1200 x 1200 ppp, vitesse jusqu'à 28 ppm, écran LCD, Type de support Enveloppes, transparents, étiquettes, papier ordinaire, papier photo, Papier vélin, carte-copie, cartes postales, capacité totale 260 feuilles, niveau sonore 53 dBA, interfaces 1 x USB 2.0, 4 pin USB Type B, 1 x LAN - RJ-45, dim (LxPxH) 37,05 x 40,74 x 22,39 cm, 6,9 kg;3;
1096;ART2790;Imprimante multifonctions couleurA3;FA0017;349,90  EUR;419,88  EUR;-1,000;-1,000;;;;707401;HP Officejet Pro 7740 All-in-One - Imprimante multifonctions - couleur - jet d'encre - A3/Ledger (297 x 432 mm) (original) - A3 (support) - jusqu'à 18 ppm (copie) - jusqu'à 22 ppm (impression) - 250 feuilles - 33.6 Kbits/s - USB 2.0, LAN, Wi-Fi(n), hôte U Garantie 1an;3;
1097;ART1700;Imprimante Officejet Pro 7720;FA0017;199,00  EUR;238,80  EUR;;;;;;707401;"HP Officejet, Imprimante multifonctions, Ecran tactile 2.65"",  Recto-verso, Résolution jusqu'à 1200 x 1200 ppp, Vitesse d'impression jusqu'à 34 ppm (mono), jusqu'à 34 ppm (couleur), Type de support  enveloppes, papier uni, cartes, étiquettes, papier photo, papier épais, papier brillant, papier mat, Capacité totale 250 feuilles, interfaces 1 x LAN - RJ-45, 1 x USB 2.0 - USB 4 broches type B, 2 x modem - RJ-11, 1 x USB host - USB de type A 4 broches, Dimensions (LxPxH) 58.49 x 49,5 x 40.8 cm, 19,5 kg, Garantie 1 an";3;
1098;ART1699;Imprimante Officejet Pro 8022;FA0017;179,00  EUR;214,80  EUR;;;;;;707401;"HP Officejet, Imprimante multifonctions,  Ecran tactile 2.7"", Recto-verso, Résolution jusqu'à 1200 x 1200 ppp, Vitesse d'impression jusqu'à 29 ppm (mono), jusqu'à 25 ppm (couleur), Type de support  papier uni, papier photo, papier épais, carte-copie, papier brillant, papier mat, Capacité totale 225 feuilles, interfaces 1 x modem - RJ-11, 1 x LAN - RJ-45, Dimensions (LxPxH) 46 x 34.12 x 23.4 cm, 8,2 kg, Garantie 1 an";3;
1099;ART1425;Imprimante portable PJ722Z1;FA0017;489,00  EUR;586,80  EUR;-2,000;-2,000;;;;707401;Imprimante portable PJ722Z1 thermique 203 x 200 Dpi 32 Mo de RAM 6 Mo Flash USB 2.0 Bluetooth Largeur: 25.5 cm Profondeur: 5.5 cm Hauteur: 3 cm Poids: 480 g Garantie limitée - 3 ans;3;
1100;ART2191;INCIPIO Sacoche pour tablette;FA0013;49,00  EUR;58,80  EUR;;-1,000;;1,000;;707101;INCIPIO, Étui protecteur pour tablette noir, Fermeture éclair, Garantie 1 an  Information pour nous :  Compatible pour la tablette Microsoft Surface Pro 7+;3;
1101;ART2732;Infogérance;FA0018;474,00  EUR;568,80  EUR;;;;;;706601;Prestation d’infogérance : 1er Niveau : Alertes en temps réel : Surveillance du matériel informatique : serveur, postes et applications à distance (Dès qu’une alerte remonte à notre monitoring, une étude de celle-ci est effectuée pour mettre en place une action de résolution sans que les utilisateurs s’en rendent compte)  2ème Niveau : L’automatisation informatique : La configuration des infrastructures informatiques Le déploiement d’applications Les mises à jour Les correctifs de sécurité Les sauvegardes Les tests La surveillance de l’infrastructure  3ème Niveau : La gestion des correctifs de sécurité : Amélioration des performances Résolution des failles de sécurité  Veille informatique afin de lutter contre les logiciels malveillants, éviter les erreurs de configuration de votre système. (Les bénéfices de cette mesure préventive sont nombreux : Système informatique plus sécurisé, temps d’arrêt du système réduit, pannes d’applications moins fréquentes.  4ème Niveau : L’assistance sur site et aide aux utilisateurs : L’aide aux utilisateurs : Services de téléassistance par la Hotline (diagnostic et intervention à distance) L’assistance sur site : Problème survenu sur site, une intervention est automatiquement prévue par un technicien dédié. ;4;
1102;ART1787;INFOSEC Bandeau Rackable 8 prises;FA0012;84,90  EUR;101,88  EUR;-1,000;-1,000;;;;707103;Bandeau distribution rackable 8 prises FR + câble alim IEC C14/sortie IEC C13, couleur noir, dimensions 48,5 x 4,5 x 4,5 cm Garantie 1 an;3;
1103;ART1814;Installation tel portable;FA0018;79,00  EUR;94,80  EUR;;;;;;706404;Livraison et installation du téléphone mobile :    - Installation de la carte SIM    - Installation de la messagerie collaborative personnelle (contact / mail)  - Sécurisation de l’appareil avec login / mot de passe  - Installation du système de géolocalisation   Le transfert de données personnel (SMS, contacts sur le téléphone, photos) sera géré par vos soins  Information pour nous :  Matériel inclus :  30 min / tel;4;
1104;ART1504;INTEL Disque Dur 512 Go SSD;FA0008;129,00  EUR;154,80  EUR;10,000;;;10,000;;707101;INTEL, Disque dur interne, Capacité 512 Go SSD, Format M.2 2280, Interface 1 x PCI Express 3.0 x4 (NVMe), Poids 10g,  Garantie 5 ans;3;
1105;ART2475;Intel Xeon Gold 5218R;;;;;;;;;707102;"Serveur rack  Intel Xeon Gold 5218R / P24466-B21 / SUR COMMANDE 2.1 GHz 20 c¿urs pour Nimble Storage dHCI Large Solution with HPE ProLiant DL380 Gen10; ProLiant DL380 Gen10 Poids Brut: 0,98 Kg ";3;
1106;ART2611;Intégration et développement du S.I;FA0018;40,00  EUR;48,00  EUR;;;;;;706501;Intégration et développement du site internet :  - Réalisation de la structure du site avec un CMS pour gérer facilement le contenu  - Intégration en HTML5/CSS3/JS de la charte graphique  - Comptabilité responsive mobile;4;
1107;ART2537;IP Publique fixe;;9,90  EUR;11,88  EUR;;;;;;706403;IP Publique Fixe pour votre lien internet ou 4G;4;
1108;ART1810;"Iphone 7 Téléphone portable 4.7""";FA0024;459,00  EUR;550,80  EUR;-1,000;-1,000;;;;707201;"APPLE, Téléphone portable, Iphone 7, Ecran LCD  tactile 4,7"",  Résolution 1334 x 750 pixels, Capacité 32 Go, Caméra arrière, caméra avant, lecteur audio, enregistreur vocal, haut-parleurs stéréo, navigation, Service messagerie SMS, MMS, IOS 10,  Couleur or,  Garantie 1 an  Information pour nous :  Matériel inclus :  Câble USB, adaptateur d'alimentation, Apple EarPods avec connecteur Lightning";3;
1109;ART1811;"Iphone11 Pro Max Tél portable 4.7""";FA0024;1419,00  EUR;1702,80  EUR;;;;;;707201;"APPLE, Téléphone portable, Iphone 11, Ecran LCD  tactile 6.5"", Capacité 256 Go, Face ID,  Résolution 2688 x 1242 pixels, Caméra avant, enregistreur vocal, haut-parleurs stéréo, navigation, Service messagerie SMS, MMS, IOS 10,Couleur argent,  Garantie 1 an  Information pour nous :  Matériel inclus :  Apple EarPods avec connecteur Lightning, adaptateur d'alimentation USB-C 18 W, Lightning vers câble USB-C";3;
1110;ART1836;IRIScan 5 Pro, visualiseur numériqu;FA0013;269,90  EUR;323,88  EUR;;-2,000;;2,000;;707401;IRIS, Vidéo-visualiseur numérique, Filaire, Résolution vidéo numérique maximum1280 x 1024, Réglage manuel de la mise au point, Format pris en charge JPEG, PDF, Interfaces USB 2.0 - USB Type B 4 broches, Hôte USB 2.0 - USB Type A 4 broches, Dimensions (LxPxH) 8,5 x 7,5 x 37,5 cm, Poids 800 g, Garantie 1 an  Information pour nous :  Câbles inclus : 1 - câble USB - externe  Accessoires inclus : Pavé de numérisation ;3;
1111;ART1595;IRIScan Pro 5, scanner de documents;FA0017;269,90  EUR;323,88  EUR;;;;;;707401;IRIS, Scanner de documents, Résolution optique 600 dpi, Impression recto-verso, Vitesse maximale de numérisation en noir et blanc 23 ppm, Vitesse maximale de numérisation en couleur 17 ppm, Type de document papier uni, carte de visite, carte en plastique, Capacité de stockage 20 pages, Interfaces USB 2.0, Dimensions (LxPxH) 29.9 x 10.4 x 7.4 cm, Poids 1.4 kg, Garantie 1 an  Information pour nous :  Câbles inclus : 1 x câble USB ;3;
1112;ART1907;JABRA Casque PRO 2300 filaire Mono;FA0014;159,00  EUR;190,80  EUR;-7,000;-7,000;;;;707201;JABRA, Casque filaire, 1 écouteur, Micro antibruit, Poids 49g, Garantie 2 ans;3;
1113;ART0338;JABRA Casque PRO 920 sans fil Mono;FA0014;159,00  EUR;190,80  EUR;1,000;-6,000;;7,000;;707201;JABRA, Casque sans fil, 1 écouteur, Micro antibruit, Fonctions décroché/raccroché, réglage volume et fonction secret, témoins lumineux sur la base, Portée DECT de 120 mètres, Mode conférence : connectez jusqu'à 4 casques sur une même base, Poids 29g, Garantie 2 ans;3;
1114;ART1908;JABRA câble pour casque;FA0014;49,00  EUR;58,80  EUR;;;;;;707103;JABRA, câble pour casque, Interface RJ-10, RJ-9 - mâle, Dimension 2m, Garantie 2 ans  Information pour nous :   Compatible avec le casque filaire JABRA PRO 2300  (2303-820-104) ;3;
1115;ART2664;Jabra Evolve2 65;FA0014;289,00  EUR;346,80  EUR;-3,000;-3,000;;;;707201;Jabra Evolve2 65 - Micro-casque arceau sans fil, stéréo - Connexion en USB via le dongle fourni - Écouteurs avec réduction active du bruit - Microphone avec annulation des bruits de fond, rétractable. - Technologie sans fil Bluetooth, portée de 30m maxi - Autonomie : jusqu'à 25h en conversation, 32h en mode musique - Témoin lumineux d’appel : ne soyez plus dérangé lors de vos appels - Commandes intégrées : volume, muet, prise d'appel, play/pause;3;
1116;ART2656;Jabra Evolve2 75;FA0014;289,00  EUR;346,80  EUR;-8,000;-6,000;2,000;;;707201;Jabra Evolve2 75- Micro-casque arceau sans fil, stéréo - Connexion en USB via le dongle fourni - Écouteurs avec réduction active du bruit - Microphone avec annulation des bruits de fond, rétractable. - Technologie sans fil Bluetooth, portée de 30m maxi - Autonomie : jusqu'à 25h en conversation, 32h en mode musique - Témoin lumineux d’appel : ne soyez plus dérangé lors de vos appels - Commandes intégrées : volume, muet, prise d'appel, play/pause;3;
1117;ART2905;JABRA SPEAK 410 - Haut-parleur;;99,00  EUR;118,80  EUR;-8,000;-8,000;;;;707101;JABRA - haut-parleur de bureau portatif, Omni Directional / bruit filtre, large bande/ Hifi, Digital Signal Processing (DSP), sortie audio mono, filaire, (LxPxH) 12 cm x 12 cm x 3.3 cm, 180.3 g - Garantie 2 ans ;3;
1118;ART2705;Jabra Speak 810;FA0014;659,00  EUR;790,80  EUR;-2,000;-2,000;;;;707201;"Jabra SPEAK 810 Audioconférence avec connexions USB-BT-AUX, solution audio optimisée pour groupes de réunion, qualité supérieure du haut-parleur, Plug&Play, réglage du volume et fonction ""muet"" - Garantie 2 ans";3;
1119;ART2366;Jabra SPEAK - Haut-parleur;;289,00  EUR;346,80  EUR;-4,000;-4,000;;;;707101;Jabra SPEAK - Haut-parleur;3;
1120;ART0340;JABRA, Casque PRO 920 sans fil Duo;FA0014;229,00  EUR;274,80  EUR;-2,000;-6,000;;4,000;;707201;JABRA, Casque sans fil DECT, 2 écouteurs en simili cuir, Micro antibruit, Fonctions répondre / raccrocher, volume, mute, Portée jusqu'à 120m,  Poids 0,027, Garantie 2 ans;3;
1121;ART0462;KENSINGTON Adaptateur USB M/F;FA0013;15,99  EUR;19,19  EUR;1,000;;;1,000;;707103;KENSINGTON, Adaptateur de type C USB, Interfaces USB de type A 4 broches (femelle), USB-C à 24 broches (mâle),  Garantie 1 an;3;
1122;ART0343;KENSINGTON Station d'accueil;FA0013;149,00  EUR;178,80  EUR;;-17,000;5,000;22,000;;707101;KENSINGTON, Station d'accueil universelle, Interfaces 1 x sortie audio , 1 x entrée audio , 1 x DVI , 1 x Gigabit Ethernet , 1 x HDMI 1 , 2 x USB 2.0 , 2 x USB 3.0, Garantie 2 ans  Information pour nous :  Câble inclus : 1 x câble USB - externe;3;
1123;ART0738;KENSINGTON, Station d'accueil;FA0013;189,00  EUR;226,80  EUR;-5,000;-18,000;4,000;17,000;;707101;KENSINGTON, Station d'accueil universelle, Interfaces 1 x sortie audio , 1 x entrée audio , 1 x DVI , 1 x Gigabit Ethernet , 1 x HDMI 1 , 2 x USB 3.0 , 4 x USB 2.0, Garantie 2 ans  Information pour nous :  Matériel inclus :  1 x adaptateur DVI-VGA - externe;3;
1124;ART2738;Kingston barrette RAM 32 GB;FA0008;59,00  EUR;70,80  EUR;-7,000;-7,000;;;;707101;Kingston - DDR4 - module - 32 Go - DIMM 288 broches - 2666 MHz / PC4-21300  - CL19 - 1.2 V - mémoire;3;
1125;ART2858;Kingston barrette RAM 4 GB;FA0008;59,00  EUR;70,80  EUR;-3,000;-3,000;;;;707101;Kingston - DDR4 - module - 4 Go - SO DIMM 260 broches - 3200 MHz / PC4-25600 - mémoire sans tampon;3;
1126;ART2373;Kingston barrette RAM 8 GB;;;;-4,000;-4,000;;;;707101;Kingston 8GB DDR4-3200MHZ MEM SINGLE RANK MODULE;3;
1127;ART2462;Kingston barrette RAM 8 GB;;;;-3,000;-3,000;;;;707101;Kingston 8GB DDR4-3200MHZ MEM SINGLE RANK MODULE;3;
1128;ART2623;Kingston barrette RAM 8 GB;FA0008;59,00  EUR;70,80  EUR;-12,000;-12,000;;;;707101;Mémoire vive - DDR4 - module - 8 Go - DIMM 288 broches - 2666 MHz / PC4-21300 - mémoire sans tampon - Garantie 2 ans ;3;
1129;ART2378;KINGSTON Disque dur 1 To SSD;FA0008;259,00  EUR;310,80  EUR;-3,000;-2,000;1,000;;;707101;"KINGSTON, Disque dur interne, Capacité 1 To SSD, Format  2.5"", Interface 1 x SATA 6 Gb/s - ATA série de 7 broches, Dimensions (LxPxH) 6,99 mm x 10 mm x 0.7 mm, Poids 92.34 g, Garantie 5 ans";3;
1130;ART1622;KINGSTON Disque dur 512 Go SSD;FA0008;99,00  EUR;118,80  EUR;-9,000;-12,000;;3,000;;707101;KINGSTON, Disque dur interne, Capacité 512 Go SSD, Format M.2 2280, Interface 1 x PCI Express 3.0 x4 (NVMe) - M.2 Card , Poids 6,8g,  Garantie 5 ans;3;
1131;ART1831;KINGSTON Disque dur 512 Go SSD;FA0008;59,00  EUR;70,80  EUR;2,000;;-1,000;1,000;;707101;KINGSTON, Disque dur interne, Capacité 250 Go SSD, Format M.2 2280, Interface 1 x PCI Express 3.0 x4 (NVMe) - M.2 Card , Poids 6,6g,  Garantie 5 ans;3;
1132;ART1912;KINGSTON Disque dur 512 Go SSD;FA0008;79,00  EUR;94,80  EUR;-12,000;-14,000;1,000;3,000;;707101;"KINGSTON, Disque dur interne, Capacité 512 Go SSD, Format 2.5"", Interface 1 x SATA 6 Gb/s - ATA série de 7 broches, Dimensions (LxPxH) 6,98 x 10,01 x 0,7 cm, Garantie 5 ans";3;
1133;ART2781;KINGSTON Disque dur 512 Go SSD;FA0008;79,00  EUR;94,80  EUR;-22,000;-17,000;5,000;;;707101;"KINGSTON, Disque dur interne, Capacité 512 Go SSD, Format 2.5"", Interface 1 x SATA 6 Gb/s - ATA série de 7 broches, Dimensions (LxPxH) 6,98 x 10,01 x 0,7 cm, Garantie 5 ans";3;
1134;ART2437;KINGSTON Disque dur 512Go SSD;FA0008;89,00  EUR;106,80  EUR;-4,000;-4,000;;;;707101;KINGSTON, Disque dur interne, Capacité 512 Go SSD, Interface 1 x PCI Express 3.0 x4 (NVMe) - M.2 Card, Dimensions (LxPxH) 22 mm x 80 mm x 2.1 mm, Poids 7 g, Garantie 3 ans;3;
1135;ART1442;KINGSTON Disque Dur 960 Go SSD;FA0008;149,00  EUR;178,80  EUR;-1,000;;1,000;;;707101;"KINGSTON, Disque dur interne, Capacité 960 Go SSD, Format 2.5"", Interface 1 x SATA 6 Gb/s - ATA série de 7 broches, Dimensions (LxPxH) 6,99 x 10 x 0,7 cm, Poids 41g, Garantie 3 ans";3;
1136;ART2198;KINGSTON Disque dur 960Go SSD;FA0008;259,00  EUR;310,80  EUR;-1,000;;1,000;;;707101;"KINGSTON, Disque dur interne, Capacité 960 Go SSD, Format  2.5"", Interface 1 x SATA 6 Gb/s - ATA série de 7 broches, Dimensions (LxPxH) 6,99 mm x 10 mm x 0.7 mm, Poids 92.34 g, Garantie 5 ans";3;
1137;ART1829;"Kingston Disque SSD - 2,5"", 256Go";FA0008;89,00  EUR;106,80  EUR;-19,000;-20,000;1,000;2,000;;707102;"KINGSTON, Disque interne SSD, format 2,5"", capacité 256 Go, chiffrement matériel XTS-AES 256 bits et TCG Opal 2.0, vitesse Lecture/Ecriture 550/500Mo/s, interface SATA 6Gb/s, Garantie 5 ans";3;
1138;ART2341;Kingston Module de RAM;;;;-3,000;-3,000;;;;707101;Kingston Module de RAM;3;
1139;ART2729;Kingston Module de RAM;;219,00  EUR;262,80  EUR;-20,000;-20,000;;;;707101;Kingston - DDR4 - module - 16 Go - DIMM 288 broches - 2666 MHz / PC4-21300 - CL19 - 1.2 V - mémoire enregistré - ECC -;3;
1140;ART2913;Kingston SSD 1To M2;;89,00  EUR;106,80  EUR;-1,000;-1,000;;;;707101;Disque dur interne, Capacité 1 To SSD, M.2 2280 - PCI Express 4.0 (NVMe), 1 x PCI Express 4.0 (NVMe) - M.2 Card, Dimensions (LxPxH) 22 mm x 80 mm x 2.2 mm, Poids 7 g, Garantie 3 ans ;3;
1141;ART2443;Kit de montage Rally;FA0013;249,00  EUR;298,80  EUR;;;;;;707103;"Support de haut-parleur : Hauteur: 36 mm ; Largeur: 266 mm ; Profondeur: 8 mm ; Support de caméra : Hauteur: 63 mm ; Largeur: 109 mm ; Profondeur: 166 mm Support de hub de table : Hauteur: 12 mm ; Largeur: 164 mm ; Profondeur: 115 mm Support de hub d'écran : Hauteur: 12 mm ; Largeur: 164 mm ; Profondeur: 115 mm ; Collier de câble : Hauteur: 23 mm ; Largeur: 164 mm ; Profondeur: 38 mm Garantie 2 ans ";3;
1142;ART2618;Kit Raspberry Pi 4 - 8GB;FA0023;;;;;;;;707101;Raspberry Pi 4 modèle B - 8GB - Broadcom BCM2711, Quad-core Cortex-A72 64bit SoC@ 1,5GHz, ARM v8 - 1 x MIPI DPI, 2 x micro HDMI, 2 x USB 2.0, 2 x USB 3.0, 1 x GPIO, 1 x MIPI CSI, 1 x micro SD - Garantie 3 ans  Accessoires inclus : - Clavier Officiel Raspberry Pi AZERTY - Souris filaire Officielle Raspberry Pi - Boîtier Officiel pour Raspberry Pi 4 - 2 Câbles officiels micro-HDMI vers HDMI 2m Blanc - Carte micro SD 16Go pour Raspberry Pi 4;3;
1143;ART1880;KONIG ELECTRONIC câble antivol pc;FA0013;10,99  EUR;13,19  EUR;-5,000;-6,000;3,000;4,000;;707103;KONIG ELECTRONIC, Câble antivol universel pour ordinateur portable, 2 clés incluses ;3;
1144;ART2805;kyocera PF-5120 Mag;FA0017;381,00  EUR;457,20  EUR;;;;;;707401;Magasin papiers de 500 feuillesGarantie 1 An constructeur  Cartouche d'encre inclus : Noir / Cyan /  Magenta  / Jjaune ;3;
1145;ART2936;Lancement accompagnement Monday;FA0018;2000,00  EUR;2400,00  EUR;;;;;;706601;Lancement et accompagnement sous le logiciel Monday :  2 journées d'accompagnement et d'intégration avec Valentin - _ journée par mois  Durée : 4 mois Date de fin : 30 juin 2024  Paiement en 4 fois, soit 500€HT/mois ;4;
1146;ART2841;LC à LC Câble Fibre Optique 5m, 50/;FA0015;39,00  EUR;46,80  EUR;-3,000;-3,000;;;;707102;10Gtek [4 Pack] OM3 LC à LC Câble Fibre Optique 5m, 50/125 Multimode Duplex Jarretière Optique LSZH pour SFP, 10G SFP+, Convertisseur de Média, 4pcs - Garantie 3 ans   ;3;
1147;ART1661;LC Jarretière 1m;FA0012;14,99  EUR;17,99  EUR;-10,000;-10,000;3,000;3,000;;707201;LC,  Jarretière 1m, Connecteurs LC-UPC, Poids 0,03Kg,  Garantie 5 ans;3;
1148;ART3082;Lecteur code barre filaire USB;FA0022;119,90  EUR;143,88  EUR;;;;;;707401;Datalogic, Douchette code barre, Type d'interface: USB Connectivité : Filaire Type de capteur : Imager (1280x800) Codes 1D / 2D Norme : IP52 , Garantie 2 ans;3;
1149;ART2826;Lecteur de disque DELL ;FA0008;89,00  EUR;106,80  EUR;;;;;;707101;Dell Slim - Lecteur de Disque - DVD±RW (±R DL)/DVD-RAM - 8x/8x/5x - USB 2.0 - Externe - pour Latitude 5310, OptiPlex 5480, Precision Mobile Workstation 5750, 77XX, Vostro 34XX, 35XX Garantie 2 ans ;3;
1150;ART1361;Lecteur/Graveur DVD Externe USB;FA0008;69,00  EUR;82,80  EUR;-2,000;-6,000;;4,000;;707101;TRANSCEND, Lecteur / Graveur de disque externe, Interface 1 x USB 2.0, Dimensions (LxPxH) 14.28 x 14.8 x 1.39 cm, Poids 246g, Garantie 2 ans  Information pour nous :  NE PAS METTRE LA MARQUE;3;
1151;ART3060;Lenevo Disque Dur Interne 1 To SSD;FA0008;219,00  EUR;262,80  EUR;-1,000;-1,000;;;;707101;Lenevo, Disque dur interne, Capacité 1 To SSD M2 PCIe 4.0 (NVME), Vitesse 6900 Mo/s (lecture) / 4400 Mo/s (écriture), Garantie 2 ans;3;
1152;ART1675;"Lenovo  - 15.6"" - A4 9125";FA0023;489,00  EUR;586,80  EUR;;;;;;707101;"Lenovo  - 15.6- A4 9125 / 2.3 GHz - Win 10 Familiale 64 bits - 8 Go RAM - 256 Go SSD - 15.6"" 1366 x 768 (HD) - Radeon R3 - Wi-Fi. Bluetooth - noir - clavier : Français";3;
1153;ART1704;"LENOVO  ThinkBook15,15"",8Go,256ssd";FA0023;725,00  EUR;870,00  EUR;-5,000;-5,000;5,000;5,000;;707101;"LENOVO, Poste  portable, Ecran 15,6"", Résolution Full HD 1920 x 1080, Processeur Intel Core I3 / 1.2 GHz (Turbo 3,4 GHz), 2 coeurs, RAM 8 Go, Disque dur 256 Go SSD, Carte graphique Intel UHD Graphics, Interfaces USB 2.0, USB 3.1 Gen 1, USB 3.1 Gen 1, USB-C 3.1 Gen 1, USB-C 3.1 Gen 2/DisplayPort, HDMI, Prise combo casque/microphone,  Bluetooth 5.0,802.11ax, Audio haut-parleurs, Windows 10 Pro, Clavier, Pavé tactile, Dimensions (LxPxH) 36.4 x 24.5 x 1.89 cm, Poids 1,8 kg, Garantie 1 an  Information pour nous :  Accessoires inclus : Adaptateur secteur ";3;
1154;ART2008;"Lenovo  ThinkBook,14"", 8go,256ssd";FA0023;819,00  EUR;982,80  EUR;-16,000;-21,000;;5,000;;707101;"ThinkBook G2- Intel Core i5-1135G7 - Win 11 Pro - Iris Xe Graphic s - 8 Go RAM - 256 Go SSD NVMe - 14"" IPS 1920 x 1080 (Full HD) - Wi-Fi - clavier Français - avec 1 an de support Premier Lenovo Garantie 1 an  Information pour nous :  Accessoires inclus : Adaptateur d'alimentation USB-C";3;
1155;ART1918;"Lenovo  ThinkBook,15"", 8go,256ssd";FA0023;799,00  EUR;958,80  EUR;;;;;;707101;"LENOVO,  Poste portable, Ecran LED 15,6"", Résolution Full HD 1920 x 1080, Anti-éblouissement, Processeur i5 / 1 GHz (Turbo 3.6 GHz), 4 coeurs, RAM 8 Go, Disque dur 256 Go SSD, Carte graphique Intel UHD Graphics, Interfaces USB 2.0, USB 3.1 Gen 1, USB 3.1 Gen 1, USB-C 3.1 Gen 1, USB-C 3.1 Gen 2/DisplayPort (Power Delivery), HDMI, Prise combo casque/microphone, Bluetooth 5.0,802.11ax, Audio  haut-parleurs stéréo, double tableau de microphone, Windows 10 Pro, Caméra, Clavier / Pavé tactile, Dimensions (LxPxH) 36.4 x 24.5 x 1.99 cm, Poids 1,8 kg, Garantie 1 an  Information pour nous :  Accessoires inclus : Adaptateur secteur";3;
1156;ART2669;"Lenovo  V15 82C,17"", 8go,512ssd";FA0023;1049,00  EUR;1258,80  EUR;-2,000;-1,000;1,000;;;707101;Lenovo IdeaPad 3 - Ryzen 7 5700U / 1.8 GHz - Win 10 - 64 bits - 8 Go RAM - 512 Go SSD NVMe - 17.3 TN 1600 x 900 (HD+) - Radeon Graphics - Wi-Fi 6, Bluetooth - gris arctique - clavier : Français Garantie 2 ans ;3;
1157;ART2419;"Lenovo  V15-IIL 82C,15"", 8go,256ssd";FA0023;729,00  EUR;874,80  EUR;;;;;;707101;"LENOVO,  Poste portable, Ecran LED 15,6"", Résolution Full HD 1920 x 1080, Anti-éblouissement, Processeur i5 / 1 GHz (Turbo 3.6 GHz), 4 coeurs, RAM 8 Go, Disque dur 256 Go SSD, Carte graphique Intel UHD Graphics, Interfaces USB 2.0, 2 x USB 3.1 Gen 1, HDMI, Prise combo casque/microphone, 802.11a/b/g/n/ac, Bluetooth 4.2, Audio haut-parleurs, Windows 10 Pro, Caméra, Clavier / Pavé tactile, Dimensions (LxPxH) 36.22 x 25.15 x 1.99 cm, Poids 1,85 kg, Garantie 1 an  Information pour nous :  Accessoires inclus : Adaptateur secteur";3;
1158;ART1840;LENOVO  V530-15ICR, 4Go,1Tohdd;FA0001;489,00  EUR;586,80  EUR;-2,000;-2,000;2,000;2,000;;707101;LENOVO, Poste fixe, Processeur i3 / 3,6 GHz, 4 coeurs, RAM 4 Go, Disque dur 1 To HDD, Carte graphique  Intel UHD Graphics 630, Interfaces 6 x USB 3.1 Gen 1, 2 x microphone, 1 x casque/microphone, 4 x USB 2.0, 1 x série, 1 x LAN (Gigabit Ethernet), 1 x VGA, 1 x DisplayPort, 1 x sortie de ligne audio, 1 x HDMI, 1 x entrée de ligne audio, 1 x sortie de ligne audio, Windows 10 Pro,  Dimensions (LxPxH) 14,5 x 27,6 x 36 cm, Poids 5,7 kg, Garantie 1 an  Information pour nous :  Matériel inclus : Souris filaire, Clavier filaire;3;
