563;ART1415;"Ecran iiyama E2083HSD-B1 20""";FA0011;129,00  EUR;154,80  EUR;;-1,000;;1,000;;707101;"IIYAMA, Ecran LED 20"", Facteur de forme 16:9, Résolution 1600 x 900, Luminosité  250 cd/m_, Contraste  5000000:1 (dynamique), 16,7 millions de couleurs, Temps de réponse 5 ms, Réglage inclinaison, Interfaces VGA, DVI-D, Entrée de ligne audio, Casque, Norme VESA 100 x 100 mm, Audio haut-parleurs - stéreo, Dimension avec support 46.95 x 20.3 x 36 cm, Poids 2,7 kg, Garantie 2 ans  Information pour nous :  Câble inclus : 1 x câble DVI - DVI-D à DVI-D, 1 x câble audio Accessoires inclus : Pied, 3 vis";3;
564;ART2290;"Ecran iiyama ProLite  23""";FA0011;189,00  EUR;226,80  EUR;;;;;;707101;"IIYAMA, Écran LED 23"" , Facteur de forme 16:9, Résolution 1920 x 1080 à 60 GHz,  Luminosité 250 cd/m_, Contraste 1000:1 / 5000000:1 (dynamique), 16.8 millions de couleurs, Réglage pivotant, inclinaison, Interfaces VGA, DVI-D, Entrée de ligne audio,  Audio Haut -parleurs, Norme VESA 100 x 100 mm,  Dimensions (LxPxH) 53,25 x 23 x 38,6 cm, Poids 5.4 kgs, Garantie 3 ans  Information pour nous :  Câbles inclus : 1 x câble DVI - DVI-D à DVI-D - 1.8 m, 1 x câble audio - 1.8 m";3;
565;ART1877;"Ecran iiyama ProLite  24""";FA0011;169,00  EUR;202,80  EUR;-2,000;;2,000;;;707101;"IIYAMA, Écran LED 24"" , Facteur de forme 16:10, Résolution 1920 x 1080 à 75 GHz,  Luminosité 250 cd/m_, Contraste 1000:1 / 80000000:1 (dynamique), 16.7 millions de couleurs, Temps de réponse 4ms, Réglage hauteur, pivot (rotation), pivotant, inclinaison, Interfaces VGA, HDMI, DisplayPort, 2 x  USB 2.0 (Type A), USB 2.0 (Type B), Casque,  Audio Haut -parleurs, Dimensions (LxPxH)  53.95 x 19.95 x 41.5 cm, Poids 4.8 kgs, Garantie 3 ans  Information pour nous :  Câbles inclus : 1 x câble USB, 1 x câble HDMI";3;
566;ART2145;"Ecran iiyama ProLite  24""";FA0011;189,00  EUR;226,80  EUR;-9,000;-13,000;1,000;5,000;;707101;"IIYAMA, Écran LED 23,8"" , Facteur de forme 16:10, Résolution 1920 x 1080 à 75 GHz,  Luminosité 250 cd/m_, Contraste 1000:1 / 80000000:1 (dynamique), 16.7 millions de couleurs, Temps de réponse 1ms, Réglage hauteur, pivot (rotation), inclinaison, Interfaces HDMI, DisplayPort, Amont USB 2.0, 2 x aval USB 2.0, Casque, Norme VESA 100 x 100 mm, Audio Haut -parleurs, stéreo, Dimensions (LxPxH) 53.9 x 25.6 x 38.75 cm, Poids 4.7 kgs, Garantie 1 an  Information pour nous :  Câbles inclus : 1 x câble HDMI, 1 x câble USB";3;
567;ART2147;"Ecran iiyama ProLite  24""";FA0011;179,90  EUR;215,88  EUR;;-2,000;;2,000;;707101;"IIYAMA, Écran LED 23,8"" , Facteur de forme 16:9, Résolution 1920 x 1080 à 75 GHz,  Luminosité 250 cd/m_, Contraste 1000:1 / 5000000:1 (dynamique), 16.7 millions de couleurs, Temps de réponse 4ms, Réglage inclinaison, Interfaces DisplayPort, HDMI, Amont USB 2.0, 2 x aval USB 2.0,  Norme VESA 100 x 100 mm, Audio Haut -parleurs, stéreo, Dimensions (LxPxH) 53.95 x 18.45 x 40.75 cm, Poids 3.6 kgs, Garantie 3 ans  Information pour nous :  Câbles inclus : 1 x câble HDMI, 1 x Câble DisplayPort, 1 x câble USB, 1 x câble audio";3;
568;ART2249;"Ecran iiyama ProLite  24""";FA0011;195,00  EUR;234,00  EUR;-17,000;-19,000;;2,000;;707101;iiyama ProLite -- Écran LED - 23.8 - 1920 x 1080 Full HD (1080p) @ 75 Hz - IPS - 250 cd/m_ - 1000:1 - 4 ms - HDMI, VGA, DisplayPort - haut-parleurs - noir mat Garantie 3 ans  Information pour nous :  Câbles inclus : 1 x câble USB, 1 x câble HDMI;3;
569;ART2114;"Ecran iiyama ProLite 22""";FA0011;169,00  EUR;202,80  EUR;-31,000;-45,000;3,000;17,000;;707101;"IIYAMA, Ecran LED 22"", Facteur de forme 16:9, Résolution Full HD (1080p) 1920 x 1080, Classe énergétique A, Luminosité 250 cd/m_, Contraste 3000:1 / 80000000:1 (dynamique), 16,7 millions de couleurs, Temps de réponse 4 ms, Réglage hauteur, pivot (rotation), pivotant, inclinaison,  Interface VGA, HDMI (HDCP), DisplayPort, Entrée de ligne audio, Casque, Audio haut-parleurs - stéreo, Dimensions (LxPxH) 50,5 x 23 x 37,15 cm, Poids 4.8 kg, Garantie 3 ans  Information pour nous :  Câble inclus : 1 x câble HDMI";3;
570;ART1935;"Ecran iiyama ProLite 24""";FA0011;159,00  EUR;190,80  EUR;-5,000;-5,000;1,000;1,000;;707101;"IIYAMA, Ecran LED 24"", Facteur de forme 16:9, Résolution Full HD (1080p) 1920 x 1080, Classe énergétique B, Luminosité 250 cd/m_, Contraste 3000:1 / 12000000:1 (dynamique), 16,7 millions de couleurs, Temps de réponse 6 ms, Réglage inclinaison,  Interface DVI-D, VGA, HDMI, Entrée de ligne audio, Audio haut-parleurs - stéreo - intégré, Dimensions (LxPxH) 54,35 x 21,35 x 38.9 cm, Poids 3.7 kg, Garantie 3 ans  Information pour nous :  Câble inclus :  1 x câble DVI - DVI-D à DVI-D, 1 x câble audio";3;
571;ART1381;"Ecran iiyama ProLite 27"" 4K";FA0011;359,50  EUR;431,40  EUR;-7,000;-7,000;;;;707101;"IIYAMA, Ecran LED 27"", Facteur de forme 16:9, Résolution 4K 3840 x 2160, Classe énergétique B, Luminosité 300 cd/m_, Contraste 80000000:1 (dynamique), 1,07 milliards de couleurs, Temps de réponse 4 ms, Réglage hauteur, pivot (rotation), pivotant, inclinaison, Interfaces DVI, HDMI, DisplayPort, USB 3.0, 2 x USB 3.0, Sortie de ligne audio (mini-prise), Norme VESA 100 x 100 mm, Audio haut-parleurs - stéreo,  Dimensions (LxPxH) 61.4 x 23 x 39.7 cm, Poids 6.4 kg, Garantie 2 ans  Information pour nous :  Câble inclus : 1 x câble HDMI (1.5 m), 1 x Câble DisplayPort (1.8 m), 1 x câble USB  (1.5 m)";3;
572;ART1941;"Ecran iiyama ProLite 28""";FA0011;349,00  EUR;418,80  EUR;-3,000;-4,000;;1,000;;707101;"IIYAMA, Ecran LED 28"", Facteur de forme 16:9, Résolution 4K UHD (2160p) 3840 x 2160 à 60 Hz, Classe énergétique C, Luminosité 300 cd/m_, Contraste 1000:1 / 20000000:1 (dynamique), 1,07 milliards de couleurs, Temps de réponse 1 ms, Réglage hauteur, pivotant, inclinaison,  Interface VGA, DVI, USB, Casque,  DisplayPort, HDMI, Audio haut-parleurs, Dimensions (LxPxH) 65,95 x 54,05 x 41,05 cm, Poids 7.5 kg, Garantie 2 ans  Information pour nous :  Câble inclus : 1 x câble HDMI , 1 x Câble DisplayPort,  1 x câble Mini DisplayPort - DisplayPort vers DisplayPort,  1 x câble USB, 1 x câble audio";3;
573;ART1626;"Ecran iiyama ProLite 32""";FA0011;919,00  EUR;1102,80  EUR;;;;;;707101;"IIYAMA, Ecran tactile LED 32"", Facteur de forme 16:9, Résolution 1920 x 1080, Classe énergétique B, Luminosité 500 cd/m_, Contraste 3000:1, Temps de réponse 8 ms, Interfaces Entrée VGA, Entrée DisplayPort, 2 x HDMI, USB, Sortie de ligne audio, Entrée de ligne audio, DVI-HDCP, Audio 2 haut-parleurs,  Dimensions (LxPxH) 74,85 x 6,8 x 45 cm, Poids 14,5 kg, Garantie 3 ans  Information pour nous :  Matériel  inclus :  Câble DisplayPort, Câble USB, Câble HDMI, Câble d'extension IR, Télécommande";3;
574;ART2616;"Ecran Iiyama ProLite 32""";FA0011;;;-8,000;-8,000;;;;707101;"Ecran Iiyama ProLite ,écran LCD à LED - 32"", format 16:9, Résolution WQHD 2560 x 1440, contraste 1200:1 / 80000000:1 (dynamique), temps de réponse 4 ms , Interface HDMI,DVI,DisplayPort, Dimensions (LxPxH) 73 cm x 23 cm x 44.45 cm, Couleur Noir, Poids 8.9 kg - garantie 2 ans";3;
575;ART1627;"Ecran iiyama ProLite 43""";FA0011;1319,00  EUR;1582,80  EUR;;;;;;707101;"IIYAMA, Ecran tactile LED 43"", Facteur de forme 16:9, Résolution Full HD (1080p) 1920 x 1080, Classe énergétique A, Luminosité 450 cd/m_, Contraste 1100:1, Couleur 16,7 millions de couleurs, Temps de réponse 12 ms, Interfaces VGA, DVI, 2 x HDMI, DisplayPort, Sortie de ligne audio, Entrée de ligne audio, Réseau, RS-232C, R entrée/sortie, Adio hut-parleurs - stéreo,  Dimensions (LxPxH) 98,75 x 6,8 x 58,77 cm, Poids 21,6 kg, Garantie 3 ans  Information pour nous :  Matériel  inclus :  1 x câble USB, 1 x câble HDMI, 1 x Câble DisplayPort, 1 x câble d'extension IR, Télécommande";3;
576;ART2365;"Ecran interactif ViewSonic 65""";FA0011;;;-1,000;-1,000;;;;707101;"Écran tactile interactif 4K de 65 pouces destiné à un usage collaboratif en salle de réunion  - Ecran tactile 65” (165 cm) UHD 4K  - Système Android 8.0  - Technologie tactile : Infrarouge  - Surface tactile “toucher indirect” (sans Optical Bonding)  - Revêtement durci et anti-relfets  - 20 points de contact tactiles, 10 points de contact écritures  - Technologie UFT (Ultra Fine Touch) au sylet ou doigt  - Haut-parleurs intégrés 2 x 10 Watts  - Partage d’écran sans fil ou en HDMI  - Connectivité : pas de WIFI / pas de Bluetooth  - Insert pour PC format Intel OPS (PC OPS optionnel)  -  Connectiques d'entrée : 3 x HDMI 2.0 ; RGB / VGA  - Connectiques de sortie : HDMI, Audio ; SPDIF  LAN RJ45 ; 3 x USB-A 2.0 ; 4 x USB-A 3.0 ; 2x USB-B  - Dimensions : 1488 x 897 x 90 mm  - Poids : 40.5 kg ";3;
577;ART2414;"Ecran LED Lenovo 23.8""";FA0011;169,00  EUR;202,80  EUR;-5,000;-5,000;;;;707101;"LENOVO, Ecran LED 23,8"", Facteur forme 16:9, Résolution Full HD  1920 x 1080 à 60 Hz,  Contraste 3000:1 / 3000000:1 (dynamique), Temps de réponse 4 ms, Réglage inclinaison, Interfaces 1 x VGA, 1 x HDMI, Dimensions (LxPxH) 53.95 x 20 x 40.27 cm,  Garantie 3 ans  Information pour nous :  Câbles inclus : Câble HDMI, câble d'alimentation";3;
578;ART1706;"Ecran LENOVO ThinkVision 23,8""";FA0011;149,00  EUR;178,80  EUR;-1,000;-11,000;;10,000;;707101;"LENOVO, Ecran LED 23,8"", Facteur forme 16:9, Résolution Full HD  1920 x 1080 à 60 Hz,  Contraste 3000:1 / 3000000:1 (dynamique), Temps de réponse 6 ms, Réglage inclinaison, Interfaces 1 x VGA, 1 x HDMI, Norme VESA 100 x 100 mm, Dimensions (LxPxH) 53.95 x 20 x 40.27 cm,  Garantie 3 ans  Information pour nous :  Câbles inclus : Câble HDMI, câble d'alimentation";3;
579;ART2317;Ecran LG 22 pouces - écran LED ;;149,00  EUR;178,80  EUR;;;;;;707101;"LG 22MK430H-B - Écran LED - 22"" (21.5"" visualisable) - 1920 x 1080 Full HD (1080p) @ 75 Hz - AH-IPS - 250 cd/m_ - 1000:1 - 5 ms - HDMI, VGA - noir mat";3;
580;ART2427;Ecran LG 24 pouces - écran LED ;;199,00  EUR;238,80  EUR;;;;;;707101;LG 24BL650C-B - Écran LED - 24 (23.8 visualisable) - 1920 x 1080 Full HD (1080p) @ 75 Hz - IPS - 250 cd/m_ - 1000:1 - 5 ms - HDMI, DisplayPort, USB-C - haut-parleurs - noir mat Garantie 2ans;3;
581;ART2372;Ecran LG 27 pouces - écran LED ;;149,00  EUR;178,80  EUR;;;;;;707101;"LG 22MK430H-B - Écran LED - 27"" (27"" visualisable) - 1920 x 1080 Full HD (1080p) @ 75 Hz - AH-IPS - 250 cd/m_ - 1000:1 - 5 ms - HDMI, VGA - noir mat";3;
582;ART2406;Ecran LG 27 pouces - écran LED ;;149,00  EUR;178,80  EUR;;;;;;707101;"LG 22MK430H-B - Écran LED - 27"" (27"" visualisable) - 1920 x 1080 Full HD (1080p) @ 75 Hz - AH-IPS - 250 cd/m_ - 1000:1 - 5 ms - HDMI, VGA - noir mat";3;
583;ART1643;"Ecran LG 29""";FA0011;269,00  EUR;322,80  EUR;4,000;;;4,000;;707101;"LG, Ecran LED 29"", Facteur de forme 21:9, Résolution UWFHD 2560 x 1080 à 75 Hz, Luminosité 250 cd/m_, Anti-reflet, Contraste 1000:1, 16,7 millions de couleurs, Temps de réponse 5 ms, Réglage inclinaison, Interfaces 2 x HDMI (HDCP), DisplayPort, Casque, Norme VESA 100 x 100 mm, Audio haut-parleurs - stéreo, Garantie 1 an  Information pour nous :  Accessoire inclus : 2 vis, support de câble Câble inclus :  1 x câble HDMI, 1 x câble audio";3;
584;ART1440;"Ecran LG 32""";FA0011;349,00  EUR;418,80  EUR;;-1,000;;1,000;;707101;"LG,  Ecran LED 32"",  Facteur de forme 16:9, Résolution 4K 3840 x 2160, Classe énergétique A, Luminosité 300 cd/m_, Anti-éblouissement, Contraste 3000:1,  1,07 milliards de couleurs, Temps de réponse 4 ms, Réglage hauteur, inclinaison, Interfaces 2 x HDMI, DisplayPort, Casque, Norme VESA 100 x 100 mm, Audio haut-parleurs - stéreo, Dimensions avec support (LxPxH)  72.81 x 23 x 49.17 cm, Poids 7 kg, Garantie 2 ans  Information pour nous :  Câble inclus : 1 x câble HDMI, 1 x Câble DisplayPort";3;
585;ART2588;Ecran Liyama Prolite LCD;FA0011;329,17  EUR;395,00  EUR;;;;;;707101;"iiyama ProLite - Écran LED - 32"" (31.5"" visualisable) - 2560 x 1440 WQHD - IPS - 300 cd/m_ - 1200:1 - 4 ms - HDMI. DVI. DisplayPort - haut-parleurs - noir";3;
586;ART2391;Ecran métallique;FA0011;187,50  EUR;225,00  EUR;-1,000;-1,000;;;;707101;Écran métallique Industriel HD de 15,6 Pouces, Moniteur Multifonctionnel à Faible consommation TFT, interfaces Multiples, écran panoramique 16: 9 1920x1080 pour PC, CCTV, caméscopes et Ordinateur(UE), Garantie 3 ans  ;3;
587;ART2857;"Ecran Philipps 32""";FA0011;239,00  EUR;286,80  EUR;-11,000;-10,000;1,000;;;707101;"Philips E-line 322E1C - Écran LED - 32"" incurvé (31.5"" visualisable) - 1920 x 1080 Full HD (1080p) - VA - 250 cd/m_ - 3000:1 - 4 ms - HDMI, VGA, DisplayPort - noir texturé Garantie 1 an ";3;
588;ART1057;"Ecran Philips  B-line Vertical 24""";FA0011;235,50  EUR;282,60  EUR;;-1,000;;1,000;;707101;"PHILIPS, Ecran LED 24"", Facteur de forme 16:9, Résolution Full HD (1080p) 1920 x 1080 à 60 Hz, Luminosité 250 cd/m_, Contraste 20000000:1 (dynamique), 16,7 millions de couleurs, Temps de réponse 5 ms, Réglage hauteur, pivot (rotation), pivotant, inclinaison, Interfaces VGA, HDMI,  DisplayPort,  2 x USB 3.0, Casque, Entrée de ligne audio, Norme VESA 100 x 100 mm, Audio haut-parleurs - stéreo, Dimensions avec support (LxPxH) 54.1 x 25.7  x 49.2 cm, Poids 5.83 kg, Garantie 3 ans  Information pour nous :  Câble inclus : 1 x câble VGA, 1 x Câble DisplayPort, 1 x câble audio";3;
589;ART1842;"Ecran PHILIPS  S-line 24""";FA0011;149,00  EUR;178,80  EUR;-2,000;-2,000;;;;707101;"PHILIPS, Ecran LED 24"", Classe énergétique A, Facteur forme 16:9, Full HD Résolution  1920 x 1080, Contraste 1000:1 / 10000000:1 (dynamique), 16.7 millions de couleurs, Temps de réponse 1 ms, Réglage inclinaison, Interfaces VGA, HDMI, Casque, DVI-D, Entrée de ligne audio,  Audio Haut-parleurs, stéreo, Dimensions avec support (LxPxH) 56 x 21.9 x 42.4 cm, Poids 3.58kg, Garantie 3 ans  Information pour nous :  Câbles inclus : Câble VGA, Câble HDMI, Câble audio";3;
590;ART1780;"Ecran PHILIPS 27""";FA0011;219,00  EUR;262,80  EUR;-35,000;-36,000;;1,000;;707101;"PHILIPS, Ecran LED 27"", Facteur de forme 16:9, Résolution Full HD (1080p) 1920 x 1080 à 75 Hz, Classe énergétique B, Luminosité 250 cd/m_, Anti-éblouissement, Contraste 3000:1, Temps de réponse 4 ms, Réglage inclinaison,  Interface VGA HDMI, DisplayPort, Casque, Entrée de ligne audio, Montage VESA 100 x 100 mm, Dimensions avec support (LxPxH) 61.1 x 20.3 x 46.2 cm, Poids 3.85 kg, Garantie 2 ans  Information pour nous :  Câble inclus : 1 x câble HDMI, 1 x câble audio,  Cordon  d'alimentation";3;
591;ART2472;"Ecran PHILIPS B Line 27""";FA0011;569,00  EUR;682,80  EUR;-2,000;-2,000;;;;707101;"Philips - Écran LED - 27"" - 1920 x 1080 Full HD (1080 p) @ 60 Hz - IPS - 250 cd/m_ - 1000:1 - 5 ms - HDMI, DVI-D, VGA, DisplayPort - Réglage Hauteur, pivot (rotation), pivotant, inclinaison - haut-parleurs - noir, Webcam - Dimensions 62.5 cm x 22.4 cm x 55.2 cm - Garantie 2 ans";3;
592;ART1708;"Ecran PHILIPS Brilliance 43""";FA0011;569,00  EUR;682,80  EUR;-4,000;-4,000;1,000;1,000;;707101;"PHILIPS, Ecran LED 43"", Classe énergie B, Facteur forme 16:9, Résolution Full HD  1920 x 1080 à 60 Hz,  Contraste  1200:1 / 50000000:1 (dynamique), 1,07 milliards de couleurs, Temps de réponse 5 ms, Interfaces VGA, 2 x MHL / HDMI, 2 x DisplayPort, 4 x USB 3.0, Entrée de ligne audio, Casque, Audio haut-parleurs, Norme VESA 200 x 200 mm, Dimensions (LxPxH) 96,8 x 25,9 x 63 cm, Poids 9,72 Kg,  Garantie 2 ans  Information pour nous :  Câbles inclus : VGA, HDMI, DP, Audio, alimentation";3;
593;ART0915;"Ecran Philips V-line  23,8""";FA0011;145,90  EUR;175,08  EUR;-21,000;-24,000;2,000;5,000;;707101;"PHILIPS, Ecran LED 23,8"", Facteur de forme 16:9, Résolution Full HD 1920 x 1080 à 60Hz, Classe énergétique A, Luminosité 250 cd/m_, Contraste 10 000 000:1, 16,7 millions de couleurs, Temps de réponse 5 ms, Réglage inclinaison, Interfaces VGA, HDMI, DisplayPort, Norme VESA 100 x 100, Audio Haut-parleurs, stéreo  Dimensions avec support (LxPxH) 54 cm x 20.9 cm x 41.5 cm, Poids 3.5 kg, Garantie 2 ans  Information pour nous :  Câble inclus : 1 x câble VGA et 1 x câble audio";3;
594;ART2507;"Ecran Philips V-line  23,8""";FA0011;139,90  EUR;167,88  EUR;;;;;;707101;Philips E-line 241E1SCA - Écran LED - incurvé - 24 (23.6 visualisable) - 1920 x 1080 Full HD (1080p) - VA - 250 cd/m_ - 3000:1 - 4 ms - HDMI, VGA - haut-parleurs - noir texturé Garantie 2 ans ;3;
595;ART2582;"Ecran Philips V-line  23,8""";FA0011;159,00  EUR;190,80  EUR;;;;;;707101;Philips E-line 24 - Écran LED - incurvé - 24 (23.6 visualisable) - 1920 x 1080 Full HD (1080p) @ 75 Hz - VA - 240 cd/m_ - 3000:1 - 4 ms - HDMI, VGA - noir texturé Garantie 2 ans  ;3;
596;ART1431;"Ecran Samsung  - 24""";FA0011;129,90  EUR;155,88  EUR;-29,000;-14,000;17,000;2,000;;707101;"SAMSUNG, Ecran LED 24"", Facteur de forme 16:9, Résolution Full HD (1080p) 1920 x 1080 à 60 Hz, Classe énergétique A, Luminosité 250 cd/m_, Contraste 1000:1, 16,7 millions de couleurs, Temps de réponse 4ms, Réglage inclinaison, Interfaces VGA, HDMI, Norme VESA 75 x 75 mm, Dimensions avec support (LxPxH) 54.77 x  20.65 x 41.8 cm, Poids 3.3 kg, Garantie 2 ans  Information pour nous :  Câble inclus : 1 x câble HDMI";3;
597;ART2619;"Ecran SAMSUNG 22""";FA0011;149,00  EUR;178,80  EUR;-12,000;-11,000;1,000;;;707101;"Samsung - T35F Series - écran LED - 22"" - 1920 x 1080 Full HD (1080p) @ 75 Hz - IPS - 250 cd/m_ - 1000:1 - 5 ms - HDMI, VGA - gris foncé/bleu Garantie 3 ans ";3;
598;ART2621;"Ecran Samsung 24""";FA0011;159,00  EUR;190,80  EUR;-9,000;-9,000;;;;707101;"Samsung - écran LED - Full HD (1080p) - 24"" IPS FHD 1920x1080 16:9 1000:1 250cd/m2 5ms dark blue gray Garantie 3 ans  Information pour nous :  Câble inclus :  1 x câble DVI - DVI-D à DVI-D, 1 x câble audio";3;
599;ART2125;"Ecran Samsung C24F396FHU, 24""";FA0011;159,00  EUR;190,80  EUR;;;;;;707101;"SAMSUNG, Écran LED 24"", Facteur de forme 16:9, Résolution Full HD (1080 p) 1920 x 1080 à 60 GHz,  Luminosité 250 cd/m_, Contraste 3000:1, 16.7 millions de couleurs, Temps de réponse 4 ms, Réglage inclinaison,  Norme VESA 75 x 75 mm, Interfaces VGA, HDMI, Casque, Dimensions avec support (LxPxH) 54,78 x 21,88 x 42,39 cm, Poids 3.3 kg";3;
600;ART2076;"Ecran Samsung C27T550FDU 27""";FA0011;239,00  EUR;286,80  EUR;-5,000;-6,000;;1,000;;707101;"SAMSUNG,  Écran LED 27"" , Classe énergétique classe B, Résolution Full HD 1920 x 1080 à 75 Hz, Luminosité 250 cd/m_, Contraste 3000:1 / 16,7 millions de couleurs, Temps de réponse 4 ms, Réglage Inclinaison, Interfaces VGA, DisplayPort, HDMI, Entrée de ligne audio, Casque, Dimensions avec support (LxPxH) 61,32 x 24.96 x 45.81 cm, Poids 5.1kgs, Garantie 2 ans  Information pour nous :  Câbles inclus : 1 x câble HDMI";3;
601;ART2788;Ecran Samsung C32R500FHR 32'';FA0011;159,00  EUR;190,80  EUR;;;;;;707101;Écran LED - incurvé - 32 (31.5 visualisable) - 1920 x 1080 Full HD (1080p) @ 75 Hz - VA - 300 cd/m_ - 3000:1 - 4 ms - HDMI, VGA - gris foncé/bleu - Garantie 1an;3;
602;ART2299;"Ecran Samsung F24T400FHR 24""";FA0011;149,00  EUR;178,80  EUR;-7,000;-7,000;;;;707101;"SAMSUNG, Ecran LED 24"", Facteur de forme 16:9, Résolution Full HD (1080p) 1920 x 1080 à 60 Hz, Classe énergétique A, Luminosité 250 cd/m_, Contraste 1000:1, 16,7 millions de couleurs, Temps de réponse 4ms, Réglage inclinaison, Interfaces VGA, HDMI, Norme VESA 75 x 75 mm, Dimensions avec support (LxPxH) 54.77 cm x 20.65 cm x 41.8 cm, Poids 3.3 kg, Garantie 2 ans ";3;
603;ART1970;"Ecran Samsung F24T450FQU, 24""";FA0011;199,00  EUR;238,80  EUR;;-5,000;;5,000;;707101;"SAMSUNG, Écran LED 24"", Facteur de forme 16:9, Résolution Full HD (1080 p) 1920 x 1080 à 75 GHz, Classe énergétique A, Luminosité 250 cd/m_, Contraste 1000:1, 16.7 millions de couleurs, Temps de réponse 5ms, Réglage hauteur, pivot (rotation), pivotant, inclinaison,  Interfaces DisplayPort (mode DisplayPort 1.2), 2 x HDMI, Casque, 2 x USB 2.0,  Norme VESA 100 x 100 mm, Dimensions avec support (LxPxH) 53.92 x 33.28 x 37.09 cm, Poids 4 kg, Garantie 3 ans  Information pour nous :  Câble inclus : 1 x câble HDMI, ";3;
604;ART1949;"Ecran SAMSUNG S22E450DW 22""";FA0011;159,00  EUR;190,80  EUR;;;;;;707101;"SAMSUNG, Ecran LED 22"", Facteur de forme 16:10, Résolution 1680 x 1050 à 60 Hz, Luminosité 250 cd/m2, Contraste 1000:1 , 16,7 millions de couleurs, Temps de réponse 5 ms, Réglage hauteur, pivot (rotation), inclinaison, Interfaces VGA, DVI, DisplayPort, Dimension avec support (LxPxH) 50.24 x 21 x 38.75 cm, Poids 5.03 kg, Garantie 2 ans  Information pour nous :  Câbles inclus : 1 câble VGA, 1 câble displayport";3;
605;ART2087;"Ecran Samsung S24D332H 24""";FA0011;169,00  EUR;202,80  EUR;-10,000;-12,000;;2,000;;707101;"SAMSUNG,  Écran LED 24"" ,Résolution Full HD 1920 x 1080 à 75 Hz, Luminosité 250 cd/m_, Contraste 3000:1 / 16,7 millions de couleurs, Temps de réponse 4 ms, Réglage Inclinaison, Interfaces VGA, DisplayPort, HDMI, Entrée de ligne audio, Casque, Dimensions avec support (LxPxH) 61,32 x 24.96 x 45.81 cm, Poids 5.1kgs, Garantie 2 ans ";3;
606;ART0625;"Ecran Samsung S24E450B 24""";FA0011;159,00  EUR;190,80  EUR;4,000;-2,000;2,000;8,000;;707101;"SAMSUNG,  Écran LED 24"", Facteur de forme 16:9, Résolution Full HD 1920 x 1080 à 60 GHz,  Luminosité 250 cd/m_, Contraste 1000:1, 16.7 millions de couleurs, Temps de réponse 5ms (gris à gris), Réglage hauteur,pivot (rotation),pivotant,inclinaison, Interfaces VGA, DVI , Norme VESA 100 x 100 mm , Dimensions avec support (LxPxH) 56.54 x 22.4 x 35.68 cm, Poids 5.1 kg, Garantie 3 ans  Information pour nous :  Câbles inclus : 1 x câble VGA";3;
607;ART1885;"Ecran Samsung S24E450F 24""";FA0011;169,00  EUR;202,80  EUR;;-1,000;;1,000;;707101;"SAMSUNG,  Écran LED 24"" , Facteur de forme 16:9, Classe énergétique B, Résolution Full HD 1920 x 1080 à 60 GHz,  Luminosité 250 cd/m_, Contraste 1000:1,16,7 millions de couleurs, Temps de réponse 5 ms, Réglage hauteur, pivot (rotation), pivotant, inclinaison, Interfaces VGA, DVI, HDMI, 2 x USB 2.0, Dimensions avec support (LxPxH) 56,54 x 22,4 x 36,18 cm, Poids 5.1 kg, Garantie 3 ans  Information pour nous :  Câbles inclus : 1 x câble VGA, 1 x câble USB";3;
608;ART0605;"Ecran Samsung S24E650 24""";FA0011;215,90  EUR;259,08  EUR;2,000;;;2,000;;707101;"SAMSUNG,  Écran LED 24"" , Facteur de forme 16:10, Résolution 1920 x 1080 à 60 GHz,  Luminosité 250 cd/m_, Contraste 1000:1, 16.7 millions de couleurs, Temps de réponse 4ms, Réglage hauteur, pivot (rotation),pivotant,inclinaison, Interfaces VGA,  DVI, DisplayPort, 2X USB, entrée ligne audio, casque, Audio Haut -parleurs, Dimensions avec support (LxPxH) 55.48 x 22.4 x 38.73 cm, Poids 5.8kgs, Garantie 3 ans  Information pour nous :  Câbles inclus : 1 x câble DVI, 1 x Câble DisplayPort ";3;
609;ART1952;"Ecran Samsung S24E650PL, 23,6""";FA0011;189,00  EUR;226,80  EUR;;;;;;707101;"SAMSUNG, Écran LED 24"", Facteur de forme 16:9, Résolution Full HD (1080 p) 1920 x 1080 à 75 GHz, Classe énergétique A+, Luminosité 250 cd/m_, Contraste 1000:1, 16.7 millions de couleurs, Temps de réponse 5ms, Réglage hauteur,pivot (rotation), pivotant, inclinaison,  Interfaces DVI, DisplayPort, HDMI, Entrée de ligne audio, Casque, USB 3.0, 2 x USB 2.0, Audio haut-parleur, Dimensions avec support (LxPxH) 54,11 x 22,5 x 51,98 cm, Poids 5.3 kg, Garantie 3 ans  Information pour nous :  Câble inclus : 1 x câble HDMI, 1 x câble USB SuperSpeed";3;
610;ART1996;"Ecran Samsung S24E650PL, 24""";FA0011;189,00  EUR;226,80  EUR;-1,000;-1,000;;;;707101;"SAMSUNG, Écran LED 24"", Facteur de forme 16:9, Résolution Full HD (1080 p) 1920 x 1080 à 75 GHz, Classe énergétique A+, Luminosité 250 cd/m_, Contraste 1000:1, 16.7 millions de couleurs, Temps de réponse 5ms, Réglage hauteur,pivot (rotation), pivotant, inclinaison,  Interfaces DVI, DisplayPort, HDMI, Entrée de ligne audio, Casque, USB 3.0, 2 x USB 2.0, Audio haut-parleur, Dimensions avec support (LxPxH) 54,11 x 22,5 x 51,98 cm, Poids 4 kg, Garantie 3 ans ";3;
611;ART2693;"Ecran Samsung S27R650FDU 27""";FA0011;259,00  EUR;310,80  EUR;-1,000;-1,000;;;;707101;"SAMSUNG,  Écran LED 27"", Résolution Full HD 1080, Luminosité 370 cd/m_, Contraste 1 milliard de couleurs, Temps de réponse 1ms, Réglage Hauteur, pivot (rotation), pivotant, inclinaison, Interfaces 2 x HDMI, DisplayPort, Casque  Dimensions 53.94 cm x 20.05 cm x 47.38 cm, Poids 5.28kgs, Garantie 1 an";3;
612;ART1119;"Ecran SAMSUNG SE450 22""";FA0011;169,00  EUR;202,80  EUR;-1,000;-3,000;1,000;3,000;;707101;"SAMSUNG, Ecran LED 22"", Facteur de forme 16:10, Résolution 1680 x 1050 à 60 Hz, Luminosité 250 cd/m2, Contraste 1000:1, 16,7 millions de couleurs, Temps de réponse 5 ms, Réglage hauteur, pivot (rotation), pivotant, inclinaison, Interfaces VGA, DVI, Casque,  Entrée de ligne audio, Norme VESA 100 x 100 mm, Audio haut-parleurs, Dimensions avec support  (LxPxH) 50.24 x 21  x 35.34 cm, Poids 5.03 kg, Garantie 3 ans  Information pour nous :  Câble inclus : 1 x câble VGA, 1 x câble DVI, 1 x câble audio";3;
613;ART0667;"Ecran Samsung U28E850R 28""";FA0011;312,90  EUR;375,48  EUR;;;;;;707101;"SAMSUNG,  Écran LED 28"" , Facteur de forme 16:9, Résolution 4K UHD - 3840 x 2160 à 60 Hz, Classe énergétique B, Luminosité 370 cd/m_, Contraste 1000:1, 1 milliard de couleurs, Temps de réponse 1 ms, Réglage hauteur,pivot (rotation),pivotant,inclinaison, Interfaces Casque,  2 x HDMI,  DisplayPort, 4 x USB 3.0, Norme VESA 100 x 100 mm, dimensions avec support (LxPxH)  66.11 x 26.06 x 42.15 cm, Poids 7.43kgs, Garantie 3 ans  Information pour nous :  Câbles inclus : 1 x câble HDMI, 1 x câble Mini DisplayPort / DisplayPort,  1 x câble USB SuperSpeed";3;
